{
  "manifestId": "01J8Z3H7N2X4M6P8Q1R3S5T7VW",
  "subjectKind": "DEVICE",
  "subjectId": "usb-stk500-arduino-uno-r3",
  "supportedOperations": [
    "device.flash",
    "device.readFuses",
    "device.reset"
  ],
  "limits": {
    "maxConcurrentOperations": 1,
    "maxPayloadBytes": 32768,
    "flashTimeoutMs": 60000
  },
  "versions": {
    "subjectVersion": "stk500v1-bootloader-2.0",
    "protocolVersion": "STK500v1"
  },
  "targetRequirements": {
    "usbHostMode": true,
    "minAndroidSdk": 31,
    "abi": "arm64-v8a"
  },
  "producer": {
    "name": "core-engine.device.arduino-cli",
    "version": "0.13.0",
    "instanceId": null
  },
  "issuedAtUtc": "2026-08-07T09:15:02Z",
  "unknownFields": {}
}
